"periode_data", "wilayah"                   , "no_registrasi", "jenis_halte" , "kode_barang" , "lokasi_alamat"                                                                                                                                                                                             , "lintang"   , "bujur"
"2024"        , " KOTA ADM. JAKARTA TIMUR"  , "HLT202400415" , "REGULER"     , "133010135001", "Jl. Raya Pd. Gede, Lubang Buaya, Kec. Makasar, Kota KOTA ADM. JAKARTA TIMUR, Daerah Khusus Ibukota Jakarta 13810 (Depan RS Haji Pondok Gede)"                                                              , "-6.2901059", "106.8887162"
"2024"        , " KOTA ADM. JAKARTA UTARA"  , "HLT202400508" , "REGULER"     , "133010135001", "Jl. Cilincing Raya, Semper Tim., Kec. Cilincing, Kota Jkt Utara, Daerah Khusus Ibukota Jakarta (Halte Pemandian)"                                                                                          , "-6.107791" , "106.9228942"
"2024"        , " KOTA ADM. JAKARTA UTARA"  , "HLT202400509" , "REGULER"     , "133010135001", "Jl. Raya Cilincing Utara Jakarta, RW.11, Kali Baru, Cilincing, North Jakarta City, Jakarta 14110 (Halte Bogasari)"                                                                                         , "-6.1085638", "106.9102271"
"2024"        , " KOTA ADM. JAKARTA TIMUR"  , "HLT202400510" , "REGULER"     , "133010118004", "Jl. Letjen Soeprapto dekat Institut Kalbe"                                                                                                                                                                 , "-6.1676074", "106.8722774"
"2024"        , " KOTA ADM. JAKARTA UTARA"  , "HLT202400511" , "REGULER"     , "133010135001", "Jl. Raya Cilincing Utara Jakarta, RT.1/RW.11, Kali Baru, Cilincing, North Jakarta City, Jakarta 14110 (Halte Airin)"                                                                                       , "-6.1081681", "106.9149047"
"2024"        , " KOTA ADM. JAKARTA TIMUR"  , "HLT202400512" , "REGULER"     , "133010118004", "Jl. Perintis Kemerdekaan JPO Pedongkelan dekat SMK Bahariwan"                                                                                                                                              , "-6.1680089", "106.8822876"
"2024"        , " KOTA ADM. JAKARTA UTARA"  , "HLT202400513" , "REGULER"     , "133010135001", "Jl. Raya Cilincing RT.15/RW.16, West Semper, Cilincing, North Jakarta City, Jakarta (Halte Masaji)"                                                                                                        , "-6.1081067", "106.9180883"
"2024"        , " KOTA ADM. JAKARTA TIMUR"  , "HLT202400514" , "REGULER"     , "133010118004", "Jl. Danau Sunter Barat dekat Rumah A2.19 serbang Aprindo"                                                                                                                                                  , "-6.135677" , "106.8561273"
"2024"        , " KOTA ADM. JAKARTA BARAT"  , "HLT202400515" , "REGULER"     , "133010135001", "Komp Pertokoan Lindeteves Trade Center GF-2 RA 38-39 Jl. Hayam Wuruk No. 127, RT.1/RW.6, Mangga Besar, Jakarta, Barat Jakarta City, Indonesia 11180 (Halte LTC)"                                           , "-6.14504"  , "106.8155499"
"2024"        , " KOTA ADM. JAKARTA TIMUR"  , "HLT202400516" , "REGULER"     , "133010118004", "Jl. Danau Sunter depan Gg Dadap"                                                                                                                                                                           , "-6.1288651", "106.8548036"
"2024"        , " KOTA ADM. JAKARTA TIMUR"  , "HLT202400517" , "REGULER"     , "133010118004", "Jl. Danau Sunter Selatan dekat Sekolah Junnele"                                                                                                                                                            , "-6.1438859", "106.8572724"
"2024"        , " KOTA ADM. JAKARTA PUSAT"  , "HLT202400518" , "REGULER"     , "133010135001", "Jl. Hayam Wuruk KOTA ADM. JAKARTA PUSAT, RT.14/RW.1, Kb. Klp., Kecamatan Gambir, Kota KOTA ADM. JAKARTA PUSAT, Daerah Khusus Ibukota Jakarta 10120 (Depan Grand Mercure)"                                  , "-6.1553872", "106.8181683"
"2024"        , " KOTA ADM. JAKARTA TIMUR"  , "HLT202400519" , "REGULER"     , "133010118004", "Jl. Tugu Kramat Jaya Pintu Masuk Islamic Center"                                                                                                                                                           , "-6.119818" , "106.917103"
"2024"        , " KOTA ADM. JAKARTA BARAT"  , "HLT202400520" , "REGULER"     , "133010135001", "Jl. Hayam Wuruk, RT.9/RW.5, Maphar, Kec. Taman Sari, Kota KOTA ADM. JAKARTA BARAT, Daerah Khusus Ibukota Jakarta 11140 (Depan Permata Bank)"                                                               , "-6.1553337", "106.8183542"
"2024"        , " KOTA ADM. JAKARTA TIMUR"  , "HLT202400521" , "REGULER"     , "133010118004", "Jl. Tugu Kramat Jaya depan RS Pelabuhan"                                                                                                                                                                   , "-6.1202075", "106.916699"
"2024"        , " KOTA ADM. JAKARTA UTARA"  , "HLT202400522" , "REGULER"     , "133010135001", "Jl. R E Martadinata, RW.10, Pademangan Bar., Kec. Pademangan, Kota Jkt Utara, Daerah Khusus Ibukota Jakarta 14420 (dekat JPO Rel 2)"                                                                       , "-6.1290395", "106.8399085"
"2024"        , " KOTA ADM. JAKARTA TIMUR"  , "HLT202400523" , "REGULER"     , "133010118004", "Jl. Penggilingan Raya Pondok Kopi Bawah Fly Over Pondook Kopi"                                                                                                                                             , "-6.2169045", "106.93911"
"2024"        , " KOTA ADM. JAKARTA TIMUR"  , "HLT202400524" , "REGULER"     , "133010118004", "Jl. Penggilingan Raya Dekat Halte Busway Penggilingan"                                                                                                                                                     , "-6.2151517", "106.939415"
"2024"        , " KOTA ADM. JAKARTA UTARA"  , "HLT202400525" , "REGULER"     , "133010135001", "Jl. R E Martadinata 26-17, Pademangan Bar., Kec. Pademangan, Kota Jkt Utara, Daerah Khusus Ibukota Jakarta 14420 (Samping Jl. Budi Mulya)"                                                                 , "-6.129215" , "106.8384767"
"2024"        , " KOTA ADM. JAKARTA UTARA"  , "HLT202400526" , "REGULER"     , "133010135001", "Jl. R E Martadinata 26-17, Pademangan Bar., Kec. Pademangan, Kota Jkt Utara, Daerah Khusus Ibukota Jakarta 14420 (Halte Theater Mobil)"                                                                    , "-6.1297305", "106.8354287"
"2024"        , " KOTA ADM. JAKARTA TIMUR"  , "HLT202400527" , "REGULER"     , "133010118004", "Jl. Pengilingan Raya depan Gg Swadaya"                                                                                                                                                                     , "-6.1920903", "106.9354548"
"2024"        , " KOTA ADM. JAKARTA TIMUR"  , "HLT202400528" , "REGULER"     , "133010118004", "Jl. I Gusti Ngurah Rai, RT.5/RW.9, Klender, Kec. Duren Sawit, Kota KOTA ADM. JAKARTA TIMUR, Daerah Khusus Ibukota Jakarta 13470 (Halte Jembatan)"                                                          , "-6.2140959", "106.9101828"
"2024"        , " KOTA ADM. JAKARTA UTARA"  , "HLT202400529" , "REGULER"     , "133010135001", "Jl. Pluit Selatan Raya, Pejagalan, Kec. Penjaringan, Kota Jkt Utara, Daerah Khusus Ibukota Jakarta 14440 (Sebelum Uturn Pluit Karang)"                                                                     , "-6.1116221", "106.7737146"
"2024"        , " KOTA ADM. JAKARTA UTARA"  , "HLT202400530" , "REGULER"     , "133010135001", "Jl. Ancol Timur, Ancol, Kec. Pademangan, Kota Jkt Utara, Daerah Khusus Ibukota Jakarta 14430 (Dekat Tikungan Ancol Timur)"                                                                                 , "-6.1266212", "106.84741"
"2024"        , " KOTA ADM. JAKARTA TIMUR"  , "HLT202400531" , "REGULER"     , "133010118004", "Jl. Pengilingan Raya depan Gg Swadaya"                                                                                                                                                                     , "-6.1925026", "106.9356047"
"2024"        , " KOTA ADM. JAKARTA UTARA"  , "HLT202400532" , "REGULER"     , "133010135001", "Jl. R E Martadinata Kota Tua, RT.6/RW.4, Ancol, Pademangan, North Jakarta City, Jakarta 14430 (Depan Lyandra & Partner)"                                                                                   , "-6.1211022", "106.8614867"
"2024"        , " KOTA ADM. JAKARTA TIMUR"  , "HLT202400533" , "REGULER"     , "133010118004", "Jl. Pengilingan Raya depan Gg Swadaya"                                                                                                                                                                     , "-6.2124813", "106.9447641"
"2024"        , " KOTA ADM. JAKARTA TIMUR"  , "HLT202400534" , "REGULER"     , "133010118004", "Jl. Pengilingan Raya depan Gg Swadaya"                                                                                                                                                                     , "-6.1858339", "106.9332609"
"2024"        , " KOTA ADM. JAKARTA UTARA"  , "HLT202400535" , "REGULER"     , "133010135001", "Jl. Gn. Sahari No.59, RW.13, Pademangan Bar., Kec. Pademangan, Kota Jkt Utara, Daerah Khusus Ibukota Jakarta 14420 (Samping Pompa Viaduct)"                                                                , "-6.1357972", "106.8321126"
"2024"        , " KOTA ADM. JAKARTA SELATAN", "HLT202400416" , "REGULER"     , "133010118004", "Jl. Teuku Umar, RT.1/RW.1, Gondangdia, Kec. Menteng, Kota KOTA ADM. JAKARTA PUSAT, Daerah Khusus Ibukota Jakarta 10350 (Depan U Turn)"                                                                     , "-6.1933723", "106.833116"
"2024"        , " KOTA ADM. JAKARTA TIMUR"  , "HLT202400417" , "REGULER"     , "133010135001", "Jl. Raya Pd. Gede, Lubang Buaya, Kec. Makasar, Kota KOTA ADM. JAKARTA TIMUR, Daerah Khusus Ibukota Jakarta 13810 (Sebrang RS Haji Pondok Gede 2)"                                                          , "-6.2904383", "106.8892185"
"2024"        , " KOTA ADM. JAKARTA SELATAN", "HLT202400418" , "REGULER"     , "133010118004", "KOTA ADM. JAKARTA BARAT, RW.1, Jemb. Besi, Kec. Tambora, Kota KOTA ADM. JAKARTA BARAT, Daerah Khusus Ibukota Jakarta 11320 (Halte Jembatan Besi)"                                                          , "-6.1521467", "106.7947"
"2024"        , " KOTA ADM. JAKARTA TIMUR"  , "HLT202400419" , "REGULER"     , "133010135001", "Jl. Raya Pd. Gede 38, RT.2/RW.2, Dukuh, Kec. Kramat jati, Kota KOTA ADM. JAKARTA TIMUR, Daerah Khusus Ibukota Jakarta 13550 (sebrang universitas MH.thamrin)"                                              , "-6.2882207", "106.8750622"
"2024"        , " KOTA ADM. JAKARTA UTARA"  , "HLT202400420" , "REGULER"     , "133010135001", "KOTA ADM. JAKARTA UTARA, RT.10/RW.11, Klp. Gading Bar., Kec. Klp. Gading, Kota Jkt Utara, Daerah Khusus Ibukota Jakarta 14240 (Halte Sunter Kelapa Gading)"                                                , "-6.1428646", "106.8903701"
"2024"        , " KOTA ADM. JAKARTA TIMUR"  , "HLT202400421" , "REGULER"     , "133010101001", "Jl. Persahabatan Utara 13, RT.16/RW.13, Pisangan Tim., Kec. Pulo Gadung, Kota KOTA ADM. JAKARTA TIMUR, Daerah Khusus Ibukota Jakarta 13230 (Halte Persahabatan)"                                           , "-6.2020206", "106.8831237"
"2024"        , " KOTA ADM. JAKARTA BARAT"  , "HLT202400422" , "REGULER"     , "133010118004", "Jl. Cendrawasih Raya No.17, RT.6/RW.6, Cengkareng Bar., Kecamatan Cengkareng, Kota KOTA ADM. JAKARTA BARAT, Daerah Khusus Ibukota Jakarta 11730 (Halte Bus Sekolah)"                                       , "-6.1444929", "106.7210682"
"2024"        , " KOTA ADM. JAKARTA BARAT"  , "HLT202400423" , "REGULER"     , "133010135001", "Jl. Tomang Raya, RT.5/RW.1, Jatipulo, Kec. Palmerah, Kota KOTA ADM. JAKARTA BARAT, Daerah Khusus Ibukota Jakarta 11440 (ATM Bank Lampung)"                                                                 , "-6.1768421", "106.8008636"
"2024"        , " KOTA ADM. JAKARTA PUSAT"  , "HLT202400424" , "REGULER"     , "133010118004", "Jl. Sri Sultan Hamengkubuwono IX, RT.1/RW.4, Ujung Menteng, Kec. Cakung, Kota KOTA ADM. JAKARTA TIMUR, Daerah Khusus Ibukota Jakarta 13960 (Halte Metland Menteng)"                                        , "-6.1888932", "106.9640471"
"2024"        , " KOTA ADM. JAKARTA UTARA"  , "HLT202400425" , "REGULER"     , "133010135001", "Jl. Gn. Sahari No.1, RT.12/RW.6, Pademangan Bar., Kec. Pademangan, Kota Jkt Utara, Daerah Khusus Ibukota Jakarta 14420 (depan mangga dua square)"                                                          , "-6.140643" , "106.8331419"
"2024"        , " KOTA ADM. JAKARTA SELATAN", "HLT202400426" , "REGULER"     , "133010118004", "Jl. Samanhudi KOTA ADM. JAKARTA PUSAT, RT.5/RW.3, Ps. Baru, Kecamatan Sawah Besar, Kota KOTA ADM. JAKARTA PUSAT, Daerah Khusus Ibukota Jakarta 10710 (Halte Graha Sindhu)"                                 , "-6.1599777", "106.8346509"
"2024"        , " KOTA ADM. JAKARTA PUSAT"  , "HLT202400427" , "REGULER"     , "133010135001", "Jl. Gn. Sahari, RT.7/RW.5, Gn. Sahari Utara, Kecamatan Sawah Besar, Kota KOTA ADM. JAKARTA PUSAT, Daerah Khusus Ibukota Jakarta 10720 (Halte BCA)"                                                         , "-6.1405142", "106.833096"
"2024"        , " KOTA ADM. JAKARTA SELATAN", "HLT202400428" , "REGULER"     , "133010118004", "Jl. Gn. Sahari, RW.5, Gn. Sahari Utara, Kecamatan Sawah Besar, Kota KOTA ADM. JAKARTA PUSAT, Daerah Khusus Ibukota Jakarta 10710 (Samping Kali)"                                                           , "-6.1459046", "106.8337328"
"2024"        , " KOTA ADM. JAKARTA SELATAN", "HLT202400429" , "REGULER"     , "133010118004", "Jl. Budi Utomo 7-6, Ps. Baru, Kecamatan Sawah Besar, Kota KOTA ADM. JAKARTA PUSAT, Daerah Khusus Ibukota Jakarta 10710 (Halte Budi Utomo)"                                                                 , "-6.166023" , "106.8390258"
"2024"        , " KOTA ADM. JAKARTA PUSAT"  , "HLT202400430" , "REGULER"     , "133010135001", "Jl. Gn. Sahari Pusat Jakarta, RT.1/RW.3, Utara Gunung Sahari, Sawah Besar, Pusat Jakarta City, Jakarta 10750 (Samping Jembatan)"                                                                           , "-6.1408583", "106.8334067"
"2024"        , " KOTA ADM. JAKARTA BARAT"  , "HLT202400431" , "REGULER"     , "133010135001", "Jl. Ks. Tubun 10, RT.4/RW.2, Kota Bambu Sel., Kec. Palmerah, Kota KOTA ADM. JAKARTA BARAT, Daerah Khusus Ibukota Jakarta 11420 (Sebrang Hotel Kalisma)"                                                    , "-6.1888468", "106.8082025"
"2024"        , " KOTA ADM. JAKARTA SELATAN", "HLT202400432" , "REGULER"     , "133010118004", "Jl. Dr. Sutomo Ps. Baru, Kecamatan Sawah Besar, Kota KOTA ADM. JAKARTA PUSAT, Daerah Khusus Ibukota Jakarta (Halte Pasar Baru)"                                                                            , "-6.1659829", "106.8348194"
"2024"        , " KOTA ADM. JAKARTA TIMUR"  , "HLT202400433" , "REGULER"     , "133010118004", "Jl. Gn. Sahari, RT.2/RW.1, Gn. Sahari Sel., Kec. Kemayoran, Kota KOTA ADM. JAKARTA PUSAT, Daerah Khusus Ibukota Jakarta 10710 (Halte Ps Baru Timur)"                                                       , "-6.1617553", "106.8379576"
"2024"        , " KOTA ADM. JAKARTA PUSAT"  , "HLT202400434" , "REGULER"     , "133010135001", "Jl. Ks. Tubun 93-97, RT.1/RW.4, Petamburan, Kecamatan Tanah Abang, Kota KOTA ADM. JAKARTA PUSAT, Daerah Khusus Ibukota Jakarta 11410 (Halte Bethel)"                                                       , "-6.1963976", "106.8040517"
"2024"        , " KOTA ADM. JAKARTA SELATAN", "HLT202400435" , "REGULER"     , "133010118004", "Jl. Gn. Sahari, RT.1/RW.1, Gn. Sahari Sel., Kec. Kemayoran, Kota KOTA ADM. JAKARTA PUSAT, Daerah Khusus Ibukota Jakarta 10710 (Halte Telkom)"                                                              , "-6.1608163", "106.837811"
"2024"        , " KOTA ADM. JAKARTA BARAT"  , "HLT202400436" , "REGULER"     , "133010135001", "Jl. KS. Tubun KOTA ADM. JAKARTA BARAT, RW.5, Slipi, Kec. Palmerah, Kota KOTA ADM. JAKARTA BARAT, Daerah Khusus Ibukota Jakarta 11410 (Sebrang SPBU)"                                                       , "-6.1935599", "106.805393"
"2024"        , " KOTA ADM. JAKARTA PUSAT"  , "HLT202400437" , "REGULER"     , "133010135001", "Jl. Ks. Tubun, RT.1/RW.4, Petamburan, Kecamatan Tanah Abang, Kota KOTA ADM. JAKARTA PUSAT, Daerah Khusus Ibukota Jakarta 11410 (Depan Kantor Polisi)"                                                      , "-6.1962517", "106.8048007"
"2024"        , " KOTA ADM. JAKARTA SELATAN", "HLT202400438" , "REGULER"     , "133010118004", "Jl. Raya Jakarta-Bogor, RT.6/RW.2, Pekayon, Kec. Ps. Rebo, Kota KOTA ADM. JAKARTA TIMUR, Daerah Khusus Ibukota Jakarta 13710 (Halte Deta)"                                                                 , "-6.3495063", "106.8657555"
"2024"        , " KOTA ADM. JAKARTA SELATAN", "HLT202400439" , "REGULER"     , "133010118004", "Jl. Raya Munjul, RT.6/RW.1, Munjul, Kec. Cipayung, Kota KOTA ADM. JAKARTA TIMUR, Daerah Khusus Ibukota Jakarta 13850 (Halte Munjul II)"                                                                    , "-6.349927" , "106.8928349"
"2024"        , " KOTA ADM. JAKARTA PUSAT"  , "HLT202400440" , "REGULER"     , "133010135001", "Jl. Palmerah Barat, RT.4/RW.7, Gelora, Kec. Palmerah, Kota KOTA ADM. JAKARTA BARAT, Daerah Khusus Ibukota Jakarta 10270 (Depan Sederhana)"                                                                 , "-6.20772"  , "106.7927933"
"2024"        , " KOTA ADM. JAKARTA BARAT"  , "HLT202400441" , "REGULER"     , "133010135001", "Jl. Palmerah Barat, RT.4/RW.7, Palmerah, Kec. Palmerah, Kota KOTA ADM. JAKARTA BARAT, Daerah Khusus Ibukota Jakarta 10270 (Halte Pasar Pisang)"                                                            , "-6.2078736", "106.7928127"
"2024"        , " KOTA ADM. JAKARTA SELATAN", "HLT202400442" , "REGULER"     , "133010118004", "Jl. Rawamangun Muka Barat No.9P, RT.12/RW.12, Rawamangun, Kec. Pulo Gadung, Kota KOTA ADM. JAKARTA TIMUR, Daerah Khusus Ibukota Jakarta 13220 (Halte Rawamangun Muka Barat)"                               , "-6.1965489", "106.8824216"
"2024"        , " KOTA ADM. JAKARTA UTARA"  , "HLT202400443" , "REGULER"     , "133010135001", "Jl. Cakung Cilincing Raya 14, RT.1/RW.3, Semper Tim., Kec. Cilincing, Kota Jkt Utara, Daerah Khusus Ibukota Jakarta 14130 (Halte Kebon Baru)"                                                              , "-6.1153419", "106.9244304"
"2024"        , " KOTA ADM. JAKARTA SELATAN", "HLT202400444" , "REGULER"     , "133010118004", "Jl. Haji Darip  Km 17, RT.9/RW.9, Pisangan Tim., Kec. Pulo Gadung, Kota KOTA ADM. JAKARTA TIMUR, Daerah Khusus Ibukota Jakarta 13240 (Sebrang Rutan 1 Cipinang)"                                           , "-6.2147982", "106.8845989"
"2024"        , " KOTA ADM. JAKARTA PUSAT"  , "HLT202400445" , "REGULER"     , "133010135001", "Jl. Pangeran Jayakarta 117, RT.7/RW.7, Mangga Dua Sel., Kecamatan Sawah Besar, Kota KOTA ADM. JAKARTA PUSAT, Daerah Khusus Ibukota Jakarta 10730 (Halte Pangeran Jayakarta)"                               , "-6.1417024", "106.8280839"
"2024"        , " KOTA ADM. JAKARTA SELATAN", "HLT202400446" , "REGULER"     , "133010118004", "Jl. R.Mangun Muka Raya, RW.14, Rawamangun, Kec. Pulo Gadung, Kota KOTA ADM. JAKARTA TIMUR, Daerah Khusus Ibukota Jakarta 13220 (Halte UNJ)"                                                                , "-6.1933417", "106.8801917"
"2024"        , " KOTA ADM. JAKARTA UTARA"  , "HLT202400447" , "REGULER"     , "133010135001", "Jl. Cakung Cilincing Raya, RT.2/RW.5, Rorotan, Kec. Cilincing, Kota Jkt Utara, Daerah Khusus Ibukota Jakarta 14140 (Depan KBN)"                                                                            , "-6.143905" , "106.9402953"
"2024"        , " KOTA ADM. JAKARTA UTARA"  , "HLT202400448" , "REGULER"     , "133010135001", "Jl. Cakung Cilincing Raya, RT.2/RW.5, Rorotan, Kec. Cilincing, Kota Jkt Utara, Daerah Khusus Ibukota Jakarta 14140 (Depan KBN)"                                                                            , "-6.1435233", "106.9395165"
"2024"        , " KOTA ADM. JAKARTA TIMUR"  , "HLT202400449" , "REGULER"     , "133010118004", "Jl. Lenteng Agung Raya, RT.11/RW.5, Lenteng Agung, Kec. Jagakarsa, Kota KOTA ADM. JAKARTA SELATAN, Daerah Khusus Ibukota Jakarta 12630 (Halte Kampus Tercinta)"                                            , "-6.3231508", "106.8348928"
"2024"        , " KOTA ADM. JAKARTA TIMUR"  , "HLT202400450" , "REGULER"     , "133010118004", "Jl. Raya Ps. Minggu, RT.1/RW.8, Ps. Minggu, Kec. Ps. Minggu, Kota KOTA ADM. JAKARTA SELATAN, Daerah Khusus Ibukota Jakarta 12520 (Halte Tanjung Barat)"                                                    , "-6.3028421", "106.84012"
"2024"        , " KOTA ADM. JAKARTA UTARA"  , "HLT202400451" , "REGULER"     , "133010135001", "Jl. Cakung Cilincing Raya 142, RW.3, Semper Tim., Kec. Cilincing, Kota Jkt Utara, Daerah Khusus Ibukota Jakarta 14130 (Halte Tugu)"                                                                        , "-6.1207176", "106.9257637"
"2024"        , " KOTA ADM. JAKARTA PUSAT"  , "HLT202400452" , "REGULER"     , "133010135001", "Jl. Imam Bonjol 61, RT.2/RW.5, Menteng, Kec. Menteng, Kota KOTA ADM. JAKARTA PUSAT, Daerah Khusus Ibukota Jakarta 10310 (Halte BBD)"                                                                       , "-6.1975316", "106.8251891"
"2024"        , " KOTA ADM. JAKARTA TIMUR"  , "HLT202400453" , "REGULER"     , "133010118004", "Jl. Tj. Barat Raya, RT.7/RW.7, Ps. Minggu, Kec. Ps. Minggu, Kota KOTA ADM. JAKARTA SELATAN, Daerah Khusus Ibukota Jakarta 12520 (Halte Komplek AL)"                                                        , "-6.2977135", "106.8401132"
"2024"        , " KOTA ADM. JAKARTA TIMUR"  , "HLT202400454" , "REGULER"     , "133010118004", "Jl. Tj. Barat Raya, RT.7/RW.7, Ps. Minggu, Kec. Ps. Minggu, Kota KOTA ADM. JAKARTA SELATAN, Daerah Khusus Ibukota Jakarta 12520 (Halte Depan Pegadaian)"                                                   , "-6.2972578", "106.8397415"
"2024"        , " KOTA ADM. JAKARTA PUSAT"  , "HLT202400455" , "REGULER"     , "133010135001", "Jl. Imam Bonjol 26-12, RT.3/RW.5, Menteng, Kec. Menteng, Kota KOTA ADM. JAKARTA PUSAT, Daerah Khusus Ibukota Jakarta 10310 (Halte Kartini)"                                                                , "-6.1993377", "106.8273572"
"2024"        , " KOTA ADM. JAKARTA UTARA"  , "HLT202400456" , "REGULER"     , "133010135001", "Jl. Kramat Jaya Raya, RT.2/RW.14, Tugu Utara, Kec. Koja, Kota Jkt Utara, Daerah Khusus Ibukota Jakarta 14260 (Depan ramayana semper)"                                                                      , "-6.1264917", "106.9169467"
"2024"        , " KOTA ADM. JAKARTA TIMUR"  , "HLT202400457" , "REGULER"     , "133010118004", "Jl. Komp. Depkes, RT.1/RW.7, Ps. Minggu, Kec. Ps. Minggu, Kota KOTA ADM. JAKARTA SELATAN, Daerah Khusus Ibukota Jakarta 12520 (Halte Bambu)"                                                               , "-6.2947289", "106.8407362"
"2024"        , " KOTA ADM. JAKARTA UTARA"  , "HLT202400458" , "REGULER"     , "133010135001", "Jl. Kramat Jaya Raya 20, RT.5/RW.14, Tugu Utara, Kec. Koja, Kota Jkt Utara, Daerah Khusus Ibukota Jakarta 14260 (Depan RS Pelabuhan)"                                                                      , "-6.124653" , "106.916578"
"2024"        , " KOTA ADM. JAKARTA TIMUR"  , "HLT202400459" , "REGULER"     , "133010118004", "Jl. Pegangsaan Barat No.14 RT.16/RW.06 Menteng, Kecamatan Menteng Kota KOTA ADM. JAKARTA PUSAT (Halte Pegangsaan Barat)"                                                                                   , "-6.1993028", "106.8416926"
"2024"        , " KOTA ADM. JAKARTA UTARA"  , "HLT202400460" , "REGULER"     , "133010135001", "Jl. Kramat Jaya Raya, RT.2/RW.14, Tugu Utara, Kec. Koja, Kota Jkt Utara, Daerah Khusus Ibukota Jakarta 14260 (Halte Ramayana)"                                                                             , "-6.1272069", "106.9170112"
"2024"        , " KOTA ADM. JAKARTA TIMUR"  , "HLT202400461" , "REGULER"     , "133010118004", "Jl. Letjend Suprapto, RW.1, Kec. Senen, Kota KOTA ADM. JAKARTA PUSAT, Daerah Khusus Ibukota Jakarta 10410 (Halte St.Senen)"                                                                                , "-6.1762983", "106.8441633"
"2024"        , " KOTA ADM. JAKARTA UTARA"  , "HLT202400462" , "REGULER"     , "133010135001", "Gang VC Cilingcing, Jl. Kramat Jaya Raya, RW.1, Tugu Utara, Kec. Koja, DKI Jakarta, Daerah Khusus Ibukota Jakarta 14260 (Halte Bus Sekolah)"                                                               , "-6.1234404", "106.9166489"
"2024"        , " KOTA ADM. JAKARTA TIMUR"  , "HLT202400463" , "REGULER"     , "133010118004", "Jl. Palmerah Selatan KOTA ADM. JAKARTA PUSAT, RT.4/RW.2, Gelora, Tanahabang, Kota KOTA ADM. JAKARTA PUSAT, Daerah Khusus Ibukota Jakarta 10270 (Halte Pasar Pal Merah)"                                    , "-6.2081691", "106.7971054"
"2024"        , " KOTA ADM. JAKARTA PUSAT"  , "HLT202400464" , "REGULER"     , "133010135001", "Jl. Tanah Abang II 104-78, RT.9/RW.3, Cideng, Kecamatan Gambir, Kota KOTA ADM. JAKARTA PUSAT, Daerah Khusus Ibukota Jakarta 10150 (Halte Gereja Bunda)"                                                    , "-6.1760265", "106.8105911"
