"periode_data", "wilayah"                   , "no_registrasi", "jenis_halte" , "kode_barang" , "lokasi_alamat"                                                                                                                                                                                             , "lintang"   , "bujur"
"2024"        , " KOTA ADM. JAKARTA PUSAT"  , "HLT202400001" , "TRANSJAKARTA", "133010135001", "Jl. Jend. Ahmad Yani, Klp. Gading Bar., Kec. Klp. Gading, Kota KOTA ADM. JAKARTA PUSAT, Daerah Khusus Ibukota Jakarta 14240 (Halte Busway Cempaka Mas 2)"                                                  , "-6.1659394", "106.87932"
"2024"        , " KOTA ADM. JAKARTA PUSAT"  , "HLT202400002" , "REGULER"     , "133010118004", "Jl. Raya Jakarta-Bogor, Pekayon, Kec. Ps. Rebo, Kota KOTA ADM. JAKARTA TIMUR, Daerah Khusus Ibukota Jakarta 13710 (Halte Unex)"                                                                            , "-6.3507466", "106.8648539"
"2024"        , " KOTA ADM. JAKARTA TIMUR"  , "HLT202400003" , "TRANSJAKARTA", "133010135001", "JL. DI. Panjaitan RT.12/RW.1, Cipinang Besar Selatan, Jatinegara, Kota KOTA ADM. JAKARTA TIMUR, 13340 (Halte Busway Penas Kalimalang)"                                                                     , "-6.239132" , "106.8778751"
"2024"        , " KOTA ADM. JAKARTA TIMUR"  , "HLT202400005" , "REGULER"     , "133010118004", "Jl. Sultan Iskandar Muda, RT.10/RW.6, Kby. Lama Utara, Kec. Kby. Lama, Kota KOTA ADM. JAKARTA SELATAN, Daerah Khusus Ibukota Jakarta 12240 (Halte Iskandar Muda)"                                          , "-6.24669"  , "106.8056655"
"2024"        , " KOTA ADM. JAKARTA SELATAN", "HLT202400028" , "TRANSJAKARTA", "133010135001", "Jl. Warung Jati Bar., Kota KOTA ADM. JAKARTA SELATAN, Daerah Khusus Ibukota Jakarta 12510 (Halte Busway Pejaten)"                                                                                          , "-6.2784468", "106.8298568"
"2024"        , " KOTA ADM. JAKARTA SELATAN", "HLT202400029" , "REGULER"     , "133010118004", "Jl. Gn. Sahari 44-45, RT.7/RW.5, Gn. Sahari Utara, Kecamatan Sawah Besar, Kota KOTA ADM. JAKARTA PUSAT, Daerah Khusus Ibukota Jakarta 10720 (Halte BCA)"                                                   , "-6.1409666", "106.8334816"
"2024"        , " KOTA ADM. JAKARTA SELATAN", "HLT202400030" , "REGULER"     , "133010118004", "Jl. Gn. Sahari, RT.6/RW.5, Gn. Sahari Utara, Kecamatan Sawah Besar, Kota KOTA ADM. JAKARTA PUSAT, Daerah Khusus Ibukota Jakarta 10710 (Bawah JPO Sebrang Law Office Kahar Nawir)"                          , "-6.1466535", "106.8342096"
"2024"        , " KOTA ADM. JAKARTA PUSAT"  , "HLT202400031" , "TRANSJAKARTA", "133010135001", "Jl. Wr. Jati Timur Raya, RT.12/RW.5, Kalibata, Kec. Pancoran, Kota KOTA ADM. JAKARTA SELATAN, Daerah Khusus Ibukota Jakarta 12510 (Halte Busway Buncit Indah)"                                             , "-6.27492"  , "106.83029"
"2024"        , " KOTA ADM. JAKARTA SELATAN", "HLT202400032" , "TRANSJAKARTA", "133010135001", "Jl. Warung Buncit Raya No.324, RT.6/RW.3, Kalibata, Kec. Pancoran, Kota KOTA ADM. JAKARTA SELATAN, Daerah Khusus Ibukota Jakarta 12740 (Halte Busway Warung Jati)"                                         , "-6.2624117", "106.8299219"
"2024"        , " KOTA ADM. JAKARTA SELATAN", "HLT202400033" , "REGULER"     , "133010118004", "Jl. Gn. Sahari, RT.1/RW.3, Gn. Sahari Utara, Kecamatan Sawah Besar, Kota KOTA ADM. JAKARTA PUSAT, Daerah Khusus Ibukota Jakarta 10750 (Halte PD Inka)"                                                     , "-6.152692" , "106.8359055"
"2024"        , " KOTA ADM. JAKARTA SELATAN", "HLT202400034" , "TRANSJAKARTA", "133010135001", "Jl. Mampang Prapatan Raya RT.2/RW.1, Duren Tiga, Pancoran, Kota KOTA ADM. JAKARTA SELATAN, 12760 (Halte Busway Imigrasi)"                                                                                  , "-6.2421656", "106.8257643"
"2024"        , " KOTA ADM. JAKARTA SELATAN", "HLT202400035" , "REGULER"     , "133010118004", "Jl. Raya Jakarta-Bogor, RT.4/RW.1, Kp. Tengah, Kec. Kramat jati, Kota KOTA ADM. JAKARTA TIMUR, Daerah Khusus Ibukota Jakarta 13540 (Sebrang Alfamart Dekat Polsek Ciracas)"                                , "-6.2897645", "106.8709507"
"2024"        , " KOTA ADM. JAKARTA SELATAN", "HLT202400036" , "REGULER"     , "133010118004", "Jl. Garuda, RW.8, Kemayoran, Kec. Kemayoran, Kota KOTA ADM. JAKARTA PUSAT, Daerah Khusus Ibukota Jakarta 10620 (Halte Jl. Garuda)"                                                                         , "-6.1608403", "106.8481176"
"2024"        , " KOTA ADM. JAKARTA BARAT"  , "HLT202400037" , "REGULER"     , "133010118004", "Jl. Pramuka, RT.14/RW.8, Rawasari, Kec. Cemp. Putih, Kota KOTA ADM. JAKARTA PUSAT, Daerah Khusus Ibukota Jakarta 10570 (Depan Braling Knalpot)"                                                            , "-6.1918155", "106.8724558"
"2024"        , " KOTA ADM. JAKARTA SELATAN", "HLT202400038" , "TRANSJAKARTA", "133010135001", "Depkes RT.7/RW.4, Kuningan Timur, Kota KOTA ADM. JAKARTA SELATAN, 12950"                                                                                                                                   , "-6.2286521", "106.8336155"
"2024"        , " KOTA ADM. JAKARTA SELATAN", "HLT202400039" , "REGULER"     , "133010118004", "Jl. Gn. Sahari, RT.10/RW.7, Gn. Sahari Sel., Kec. Kemayoran, Kota KOTA ADM. JAKARTA PUSAT, Daerah Khusus Ibukota Jakarta 10710 (Sebrang Bank CIMB)"                                                        , "-6.1458483", "106.8340483"
"2024"        , " KOTA ADM. JAKARTA SELATAN", "HLT202400040" , "REGULER"     , "133010118004", "Jl. Industri Raya, Kota Tua, RW.10, Danau Sunter Dll, Kec. Pademangan, Kota KOTA ADM. JAKARTA PUSAT, Daerah Khusus Ibukota Jakarta 14410 (Sebrang Hermina Tower)"                                          , "-6.1491682", "106.8391993"
"2024"        , " KOTA ADM. JAKARTA PUSAT"  , "HLT202400041" , "TRANSJAKARTA", "133010135001", "JL. H.R. Rasuna Said, Menteng, 10310 KOTA ADM. JAKARTA PUSAT, Indonesia, Jakarta (Halte Busway Latuharhari)"                                                                                               , "-6.2030398", "106.8275578"
"2024"        , " KOTA ADM. JAKARTA SELATAN", "HLT202400042" , "REGULER"     , "133010118004", "Jl. Rajawali Raya 2-4, RT.5/RW.11, Halim Perdana Kusumah, Kec. Makasar, Kota KOTA ADM. JAKARTA TIMUR, Daerah Khusus Ibukota Jakarta 13610 (Depan RS AU)"                                                   , "-6.2564401", "106.8914752"
"2024"        , " KOTA ADM. JAKARTA TIMUR"  , "HLT202400043" , "TRANSJAKARTA", "133010118004", "Jl. Iskandar Muda RT.7/RW.8, Kelurahan Kebayoran Lama Selatan, Kecamatan Kebayoran Lama (Halte Kodam)"                                                                                                     , "-6.2545648", "106.7818677"
"2024"        , " KOTA ADM. JAKARTA TIMUR"  , "HLT202400044" , "TRANSJAKARTA", "133010135001", "Jl. DI. Panjaitan RT.2/RW.3, Cipinang Besar Utara, Kecamatan Jatinegara, Kota KOTA ADM. JAKARTA TIMUR, Daerah Khusus Ibukota Jakarta 13350 (Halte Busway Pedati Prumpung)"                                 , "-6.219961" , "106.8742271"
"2024"        , " KOTA ADM. JAKARTA SELATAN", "HLT202400045" , "REGULER"     , "133010118004", "Jl. Benyamin Suaeb, RW.5, Pademangan Tim., Kec. Pademangan, Kota Jkt Utara, Daerah Khusus Ibukota Jakarta 14410 (Halte Gambir Expo Pintu 3)"                                                               , "-6.1421856", "106.8482458"
"2024"        , " KOTA ADM. JAKARTA SELATAN", "HLT202400046" , "REGULER"     , "133010118004", "Jl. Benyamin Suaeb, RW.5, Pademangan Tim., Kec. Pademangan, Kota Jkt Utara, Daerah Khusus Ibukota Jakarta 14410 (Halte Gambir Expo Pintu 2)"                                                               , "-6.1454653", "106.8492133"
"2024"        , " KOTA ADM. JAKARTA PUSAT"  , "HLT202400047" , "TRANSJAKARTA", "133010135001", "Jl. Otto Iskandardinata RT.5/RW.12, Kp. Melayu, Kecamatan Jatinegara, Kota KOTA ADM. JAKARTA TIMUR, Daerah Khusus Ibukota Jakarta 13330 (Halte Busway Cawang Otista)"                                      , "-6.2436829", "106.868682"
"2024"        , " KOTA ADM. JAKARTA TIMUR"  , "HLT202400048" , "REGULER"     , "133010118004", "Jl. Benyamin Suaeb, Pademangan Tim., Kec. Kemayoran, Kota Jkt Utara, Daerah Khusus Ibukota Jakarta 14410 (Halte Gambir Expo Parkir Timur)"                                                                 , "-6.1497004", "106.8496488"
"2024"        , " KOTA ADM. JAKARTA BARAT"  , "HLT202400049" , "TRANSJAKARTA", "133010118004", "Jl. St. Senen, RW.3, Senen, Kec. Senen, Kota KOTA ADM. JAKARTA PUSAT, Daerah Khusus Ibukota Jakarta 10410 (Depan Ps. Senen)"                                                                               , "-6.1762433", "106.8434783"
"2024"        , " KOTA ADM. JAKARTA TIMUR"  , "HLT202400050" , "TRANSJAKARTA", "133010135001", "Jl. Matraman Raya RT.1/RW.6, Bali Mester, Jatinegara, Kota KOTA ADM. JAKARTA TIMUR, 13320 (Halte Busway Kebon Pala)"                                                                                       , "-6.2128497", "106.8612291"
"2024"        , " KOTA ADM. JAKARTA TIMUR"  , "HLT202400051" , "TRANSJAKARTA", "133010135001", "Jl. Matraman Raya RT.4/RW.3, Palmeriam, Kec. Matraman, Kota KOTA ADM. JAKARTA TIMUR, Daerah Khusus Ibukota Jakarta 13150 (Halte Busway Slamet Riyadi)"                                                     , "-6.2083358", "106.8590001"
"2024"        , " KOTA ADM. JAKARTA SELATAN", "HLT202400052" , "REGULER"     , "133010118004", "Jl. Bungur Besar Raya 9-20, RT.19/RW.3, Senen, Kec. Senen, Kota KOTA ADM. JAKARTA PUSAT, Daerah Khusus Ibukota Jakarta 10610 (Halte Bangau)"                                                               , "-6.1702231", "106.8427923"
"2024"        , " KOTA ADM. JAKARTA TIMUR"  , "HLT202400053" , "TRANSJAKARTA", "133010135001", "Jl. Matraman Raya RT.5/RW.4, Palmeriam, Kec. Matraman, Kota KOTA ADM. JAKARTA TIMUR, Daerah Khusus Ibukota Jakarta 13150 (Halte Busway Tegalan)"                                                           , "-6.2029849", "106.8573155"
"2024"        , " KOTA ADM. JAKARTA SELATAN", "HLT202400054" , "REGULER"     , "133010118004", "Jl. Bungur Raya 32, RW.1, Gn. Sahari Sel., Kec. Kemayoran, Kota KOTA ADM. JAKARTA PUSAT, Daerah Khusus Ibukota Jakarta 10610 (Halte Ruko)"                                                                 , "-6.1605448", "106.8395576"
"2024"        , " KOTA ADM. JAKARTA PUSAT"  , "HLT202400055" , "TRANSJAKARTA", "133010135001", "Jl. Salemba Raya RT.4/RW.5, Paseban, Senen, Kota KOTA ADM. JAKARTA PUSAT, Daerah Khusus Ibukota Jakarta 10430 (Halte Busway Salemba Capitol Park Carolus)"                                                 , "-6.1968845", "106.8511221"
"2024"        , " KOTA ADM. JAKARTA SELATAN", "HLT202400056" , "REGULER"     , "133010118004", "Jl. Benyamin Suaeb, RW.5, Pademangan Tim., Kec. Pademangan, Kota Jkt Utara, Daerah Khusus Ibukota Jakarta 14410 (Halte Gambir Expo Pintu 2 Sebrang Halte Busway Jiexpo)"                                   , "-6.1480961", "106.8492735"
"2024"        , " KOTA ADM. JAKARTA PUSAT"  , "HLT202400057" , "TRANSJAKARTA", "133010135001", "Jl. Salemba Raya RT.1/RW.3, Paseban, Kec. Senen, Kota KOTA ADM. JAKARTA PUSAT, Daerah Khusus Ibukota Jakarta 10430 (Halte Busway Salemba UI)"                                                              , "-6.1935802", "106.8492002"
"2024"        , " KOTA ADM. JAKARTA SELATAN", "HLT202400058" , "REGULER"     , "133010118004", "Jl. Tomang Raya, RT.1/RW.3, Jatipulo, Kec. Palmerah, Kota KOTA ADM. JAKARTA BARAT, Daerah Khusus Ibukota Jakarta 11440 (Depan CIMB)"                                                                       , "-6.175643" , "106.802308"
"2024"        , " KOTA ADM. JAKARTA PUSAT"  , "HLT202400059" , "TRANSJAKARTA", "133010135001", "Jl. Kramat Raya RT.1/RW.8, Kramat, Senen, Kota KOTA ADM. JAKARTA PUSAT, Daerah Khusus Ibukota Jakarta 10430 (Halte Busway Kramat Sentiong)"                                                                , "-6.18856"  , "106.8462447"
"2024"        , " KOTA ADM. JAKARTA SELATAN", "HLT202400060" , "REGULER"     , "133010118004", "Jl. Garuda 33-35, RT.9/RW.4, Gn. Sahari Sel., Kec. Kemayoran, Kota KOTA ADM. JAKARTA PUSAT, Daerah Khusus Ibukota Jakarta 10610 (Halte Muhamadiyah)"                                                       , "-6.1623328", "106.8429727"
"2024"        , " KOTA ADM. JAKARTA SELATAN", "HLT202400061" , "TRANSJAKARTA", "133010118004", "Jl. Kramat Raya RT.18/RW.1, Paseban, Kec. Senen, Kota KOTA ADM. JAKARTA PUSAT, Daerah Khusus Ibukota Jakarta (Bawah JPO Depan Plaza Kenari)"                                                               , "-6.1913672", "106.8481697"
"2024"        , " KOTA ADM. JAKARTA PUSAT"  , "HLT202400062" , "TRANSJAKARTA", "133010135001", "Jl. Kramat Raya RT.3/RW.4, Kramat, Senen, Kota KOTA ADM. JAKARTA PUSAT, 10420 (Halte Busway Pal Putih)"                                                                                                    , "-6.1843289", "106.8441604"
"2024"        , " KOTA ADM. JAKARTA TIMUR"  , "HLT202400063" , "TRANSJAKARTA", "133010135001", "Jl. Utan Kayu Raya No.109b, RW.10, Utan Kayu Utara, Kec. Matraman, Kota KOTA ADM. JAKARTA TIMUR, Daerah Khusus Ibukota Jakarta 13120 (Halte Busway Utan Kayu Rawamangun)"                                  , "-6.19747"  , "106.8740662"
"2024"        , " KOTA ADM. JAKARTA TIMUR"  , "HLT202400064" , "REGULER"     , "133010118004", "Jl. Sultan Iskandar Muda, RT.9/RW.9, Kby. Lama Sel., Kec. Kby. Lama, Kota KOTA ADM. JAKARTA SELATAN, Daerah Khusus Ibukota Jakarta 12240 (Depan Garasindo)"                                                , "-6.258294" , "106.7817331"
"2024"        , " KOTA ADM. JAKARTA UTARA"  , "HLT202400065" , "REGULER"     , "133010118001", "Lingkar Luar Timur, RT.1/RW.1, Lagoa, Kec. Koja, Kota Jkt Utara, Daerah Khusus Ibukota Jakarta 14270 (Halte Pasar Waru)"                                                                                   , "-6.1086017", "106.9148267"
"2024"        , " KOTA ADM. JAKARTA PUSAT"  , "HLT202400066" , "TRANSJAKARTA", "133010135001", "Jl. St. Senen RW.2, Senen, Kec. Senen, Kota KOTA ADM. JAKARTA PUSAT, Daerah Khusus Ibukota Jakarta 10410 (Halte Busway Sentral Senen)"                                                                     , "-6.1785041", "106.8424214"
"2024"        , " KOTA ADM. JAKARTA SELATAN", "HLT202400067" , "TRANSJAKARTA", "133010118004", "Jl. Kramat Raya, RT.2/RW.9, Kwitang, Kec. Senen, Kota KOTA ADM. JAKARTA PUSAT, Daerah Khusus Ibukota Jakarta (Halte YAI)"                                                                                  , "-6.1929687", "106.8490106"
"2024"        , " KOTA ADM. JAKARTA PUSAT"  , "HLT202400068" , "TRANSJAKARTA", "133010135001", "Jl. Budi Utomo, Ps. Baru, Kecamatan Sawah Besar, Kota KOTA ADM. JAKARTA PUSAT, Daerah Khusus Ibukota Jakarta 10710 (Halte Busway Budi Utomo)"                                                              , "-6.1660272", "106.8390382"
"2024"        , " KOTA ADM. JAKARTA SELATAN", "HLT202400069" , "TRANSJAKARTA", "133010118004", "Jl. Letjen S.Parman RT.06/RW.03 Kelurahan Slipi Kecamatan Palmerah (Sebrang Mall Slipi)"                                                                                                                   , "-6.1887117", "106.7967417"
"2024"        , " KOTA ADM. JAKARTA PUSAT"  , "HLT202400070" , "TRANSJAKARTA", "133010135001", "Jalan Gunung Sahari, Daerah Khusus Ibukota Jakarta, Indonesia|Jalan Pos, Pasar Baru, Sawah Besar, Daerah Khusus Ibukota Jakarta (Halte Busway Pasar Baru Timur)"                                           , "-6.1625049", "106.8380419"
"2024"        , " KOTA ADM. JAKARTA SELATAN", "HLT202400071" , "REGULER"     , "133010118004", "Jl. Rawasari Sel. 29-60, RW.2, Cemp. Putih Tim., Kec. Cemp. Putih, Kota KOTA ADM. JAKARTA PUSAT, Daerah Khusus Ibukota Jakarta 10570 (Depan Pasar Rawasari)"                                               , "-6.185801" , "106.8722194"
"2024"        , " KOTA ADM. JAKARTA PUSAT"  , "HLT202400072" , "TRANSJAKARTA", "133010135001", "Jl. Gunung Sahari Barat Pademangan, Pademangan, Utara Jakarta Kota, Jakarta (Halte Busway Gunung Sahari)"                                                                                                  , "-6.1338118", "106.8316743"
"2024"        , " KOTA ADM. JAKARTA SELATAN", "HLT202400073" , "REGULER"     , "133010118004", "Jl. Percetakan Negara RT.3/RW.5, Rawasari, Kec. Cemp. Putih, Kota KOTA ADM. JAKARTA PUSAT, Daerah Khusus Ibukota Jakarta (Halte Sekolah)"                                                                  , "-6.1879072", "106.8643831"
"2024"        , " KOTA ADM. JAKARTA PUSAT"  , "HLT202400165" , "REGULER"     , "133010135001", "Balekota"                                                                                                                                                                                                  , "-6.180925" , "106.8263318"
"2024"        , " KOTA ADM. JAKARTA PUSAT"  , "HLT202400166" , "TRANSJAKARTA", "133010135001", "Jl. Ir. H. Juanda No.7, RW.8, Kb. Klp., Kecamatan Gambir, Kota KOTA ADM. JAKARTA PUSAT, Daerah Khusus Ibukota Jakarta 10110 (Halte Busway Pecenongan)"                                                     , "-6.1668841", "106.8258306"
"2024"        , " KOTA ADM. JAKARTA SELATAN", "HLT202400167" , "REGULER"     , "133010118004", "Jl. Prapanca Raya 9, RT.1/RW.1, Petogogan, Kec. Kby. Baru, Kota KOTA ADM. JAKARTA SELATAN, Daerah Khusus Ibukota Jakarta 12170 (Halte Samping Walikota Jaksel)"                                            , "-6.2492663", "106.8077374"
"2024"        , " KOTA ADM. JAKARTA SELATAN", "HLT202400168" , "REGULER"     , "133010118004", "Jl. Bulungan 76-77, RT.6/RW.6, Kramat Pela, Kec. Kby. Baru, Kota KOTA ADM. JAKARTA SELATAN, Daerah Khusus Ibukota Jakarta 12130 (Depan Burger King)"                                                       , "-6.2442952", "106.7971416"
"2024"        , " KOTA ADM. JAKARTA PUSAT"  , "HLT202400169" , "TRANSJAKARTA", "133010135001", "Jl. Silang Merdeka Utara RT.5/RW.2, Gambir, Kota KOTA ADM. JAKARTA PUSAT, 10110 (Halte Busway Gambir 2)"                                                                                                   , "-6.1788859", "106.8310215"
"2024"        , " KOTA ADM. JAKARTA SELATAN", "HLT202400170" , "REGULER"     , "133010118004", "Jl. Bulungan, RT.6/RW.7, Kramat Pela, Kec. Kby. Baru, Kota KOTA ADM. JAKARTA SELATAN, Daerah Khusus Ibukota Jakarta 12130 (TK/SD Kwitang 6 PSKD)"                                                          , "-6.2414973", "106.7960983"
"2024"        , " KOTA ADM. JAKARTA PUSAT"  , "HLT202400171" , "TRANSJAKARTA", "133010135001", "Jl. Prajurit KKO Usman dan Harun No.28, Senen, Kec. Senen, Kota KOTA ADM. JAKARTA PUSAT, Daerah Khusus Ibukota Jakarta 10410 (Halte Busway Kwitang)"                                                       , "-6.1831767", "106.823257"
"2024"        , " KOTA ADM. JAKARTA TIMUR"  , "HLT202400172" , "TRANSJAKARTA", "133010135001", "Jl. Bekasi Barat, RT.4/RW.2, Rw. Bunga, Kecamatan Jatinegara, Kota KOTA ADM. JAKARTA TIMUR, Daerah Khusus Ibukota Jakarta 13350 (Halte Busway Stasiun Jatinegara)"                                         , "-6.2155356", "106.8692022"
"2024"        , " KOTA ADM. JAKARTA SELATAN", "HLT202400173" , "REGULER"     , "133010118004", "Jl. Metro Pondok Indah, RT.1/RW.16, Pd. Pinang, Kec. Kby. Lama, Kota KOTA ADM. JAKARTA SELATAN, Daerah Khusus Ibukota Jakarta 12310 (Depan Halte Busway Pondok Indah 2)"                                   , "-6.2674213", "106.7837803"
"2024"        , " KOTA ADM. JAKARTA SELATAN", "HLT202400174" , "REGULER"     , "133010118004", "Jl. St. Senen KOTA ADM. JAKARTA PUSAT, RW.3, Senen, Kec. Senen, Kota KOTA ADM. JAKARTA PUSAT, Daerah Khusus Ibukota Jakarta 10410 (Depan Pasar Senen)"                                                     , "-6.1760967", "106.84341"
"2024"        , " KOTA ADM. JAKARTA TIMUR"  , "HLT202400175" , "TRANSJAKARTA", "133010135001", "Jl. Raya Bekasi Pulo Gadung, Kota KOTA ADM. JAKARTA TIMUR, 13260 (Halte Busway Pulogadung)"                                                                                                                , "-6.1834383", "106.9087133"
"2024"        , " KOTA ADM. JAKARTA SELATAN", "HLT202400176" , "REGULER"     , "133010118004", "Jl. Bungur Raya RT.3/RW.1, Kemayoran, Kec. Kemayoran, Kota KOTA ADM. JAKARTA PUSAT, Daerah Khusus Ibukota Jakarta (Halte Armabar)"                                                                         , "-6.1639966", "106.8408569"
"2024"        , " KOTA ADM. JAKARTA PUSAT"  , "HLT202400177" , "TRANSJAKARTA", "133010135001", "Jalan Daan Mogot, RT.2/RW.12, Kalideres, Kota KOTA ADM. JAKARTA BARAT, 11840 (Halte Busway Pesakih)"                                                                                                       , "-6.1549467", "106.715215"
"2024"        , " KOTA ADM. JAKARTA SELATAN", "HLT202400178" , "REGULER"     , "133010118004", "Jl. St. Senen, RW.3, Senen, Kec. Senen, Kota KOTA ADM. JAKARTA PUSAT, Daerah Khusus Ibukota Jakarta 10410 (Halte Gelanggang)"                                                                              , "-6.1748233", "106.843245"
"2024"        , " KOTA ADM. JAKARTA SELATAN", "HLT202400179" , "REGULER"     , "133010118004", "Jl. Pangeran Antasari 9-20, RT.13/RW.2, Cipete Sel., Kec. Cilandak, Kota KOTA ADM. JAKARTA SELATAN, Daerah Khusus Ibukota Jakarta 12410 (Halte Asem)"                                                      , "-6.2730734", "106.8086367"
"2024"        , " KOTA ADM. JAKARTA SELATAN", "HLT202400180" , "REGULER"     , "133010118004", "Jl. Prof. DR. Soepomo, Tebet Bar., Kec. Tebet, Kota KOTA ADM. JAKARTA SELATAN, Daerah Khusus Ibukota Jakarta 12870 (Halte Taman Rosita)"                                                                   , "-6.2376292", "106.8442394"
"2024"        , " KOTA ADM. JAKARTA PUSAT"  , "HLT202400181" , "TRANSJAKARTA", "133010135001", "Jl. Hayam Wuruk RT.4/RW.9, Maphar, Kec. Taman Sari, Kota KOTA ADM. JAKARTA BARAT, Daerah Khusus Ibukota Jakarta 11130 (Halte Busway Mangga Besar)"                                                         , "-6.1601304", "106.8171324"
"2024"        , " KOTA ADM. JAKARTA BARAT"  , "HLT202400182" , "TRANSJAKARTA", "133010135001", "Jl. Gajah Mada RT.4/RW.6, Mangga Besar, Kec. Taman Sari, Kota KOTA ADM. JAKARTA BARAT, Daerah Khusus Ibukota Jakarta 11130 (Halte Busway Olimo)"                                                           , "-6.1491567", "106.8168305"
"2024"        , " KOTA ADM. JAKARTA SELATAN", "HLT202400183" , "TRANSJAKARTA", "133010118004", "Jl. Lapangan Bola, RW.1, Kb. Jeruk, Kec. Kb. Jeruk, Kota KOTA ADM. JAKARTA BARAT, Daerah Khusus Ibukota Jakarta 11530 (Sebrang Prudential)"                                                                , "-6.1972191", "106.7665965"
"2024"        , " KOTA ADM. JAKARTA BARAT"  , "HLT202400184" , "TRANSJAKARTA", "133010135001", "Jl. Gajah Mada RT.1/RW.6, Mangga Besar, Kec. Taman Sari, Kota KOTA ADM. JAKARTA BARAT, Daerah Khusus Ibukota Jakarta 11120 (Halte Busway Glodok)"                                                          , "-6.1436317", "106.8153133"
"2024"        , " KOTA ADM. JAKARTA SELATAN", "HLT202400185" , "REGULER"     , "133010118004", "Jl. Dr. Saharjo 82-80, RT.13/RW.8, Ps. Manggis, Kec. Tebet, Kota KOTA ADM. JAKARTA SELATAN, Daerah Khusus Ibukota Jakarta 12850 (Halte Jl. Sahrjo)"                                                        , "-6.2146781", "106.8442293"
"2024"        , " KOTA ADM. JAKARTA SELATAN", "HLT202400186" , "REGULER"     , "133010118004", "Jl. HOS. Cokroaminoto, RT.2/RW.5, Menteng, Kec. Menteng, Kota KOTA ADM. JAKARTA PUSAT, Daerah Khusus Ibukota Jakarta 10310 (Halte Gereja)"                                                                 , "-6.1988177", "106.828445"
"2024"        , " KOTA ADM. JAKARTA SELATAN", "HLT202400187" , "REGULER"     , "133010118004", "Jl. Raya Kby. Lama, RT.3, Grogol Sel., Kec. Kby. Lama, Kota KOTA ADM. JAKARTA SELATAN, Daerah Khusus Ibukota Jakarta 12220 (Halte Cidodol)"                                                                , "-6.2288342", "106.7788245"
"2024"        , " KOTA ADM. JAKARTA PUSAT"  , "HLT202400074" , "TRANSJAKARTA", "133010135001", "Jl. Gunung Sahari RT.16/RW.3, Gn. Sahari Utara, Kecamatan Sawah Besar, Kota KOTA ADM. JAKARTA PUSAT, Daerah Khusus Ibukota Jakarta 10720 (Halte Jembatan Merah)"                                           , "-6.1465179", "106.834221"
"2024"        , " KOTA ADM. JAKARTA SELATAN", "HLT202400075" , "REGULER"     , "133010118004", "Jl. Kwini II, Kecamatan Sawah Besar, Kota KOTA ADM. JAKARTA PUSAT, Daerah Khusus Ibukota Jakarta 10710 (Depan Rumah Duka Sentosa))"                                                                        , "-6.1752201", "106.8369696"
"2024"        , " KOTA ADM. JAKARTA UTARA"  , "HLT202400076" , "TRANSJAKARTA", "133010135001", "Pantai Indah RW.10, Ancol, Kec. Pademangan, Kota Jkt Utara, Daerah Khusus Ibukota Jakarta 14430 (Halte Busway Taman Impian Jaya Ancol)"                                                                    , "-6.1274594", "106.8306674"
"2024"        , " KOTA ADM. JAKARTA SELATAN", "HLT202400077" , "TRANSJAKARTA", "133010118004", "Jl. Merdeka Selatan KOTA ADM. JAKARTA PUSAT, RT.11/RW.2, Gambir, Kecamatan Gambir, Kota KOTA ADM. JAKARTA PUSAT, Daerah Khusus Ibukota Jakarta 10110 (Depan GTO Gambir)"                                   , "-6.1791258", "106.8312343"
"2024"        , " KOTA ADM. JAKARTA SELATAN", "HLT202400078" , "TRANSJAKARTA", "133010135001", "Jl. Saco Ragunan, Kec. Ps. Minggu, Kota KOTA ADM. JAKARTA SELATAN, Daerah Khusus Ibukota Jakarta 12550 (Halte Busway Kebun Binatang Ragunan)"                                                              , "-6.3057643", "106.8193656"
